Incorrect Sentence,Correct Sentence
I goes to the store everyday.,I go to the store everyday.
They was playing soccer last night.,They were playing soccer last night.
She have completed her homework.,She has completed her homework.
He don't know the answer.,He doesn't know the answer.
The sun rise in the east.,The sun rises in the east.
I am eat pizza for lunch.,I am eating pizza for lunch.
The students studies for the exam.,The students study for the exam.
The car need to be repaired.,The car needs to be repaired.
She will goes to the party tonight.,She will go to the party tonight.
They watches the movie together.,They watch the movie together.
The flowers is blooming in spring.,The flowers bloom in spring.
She think she can finish the project.,She thinks she can finish the project.
The dogs barks at the mail carrier.,The dogs bark at the mail carrier.
The kids plays video games after school.,The kids play video games after school.
The computer not working properly.,The computer is not working properly.
He had sleep for ten hours.,He had slept for ten hours.
I walk to work every day last month.,I walked to work every day last month.
She will be write a book next year.,She will be writing a book next year.
The chef cook dinner for the guests.,The chef cooks dinner for the guests.
They plants a tree in the garden.,They plant a tree in the garden.
I has been to Paris three times.,I have been to Paris three times.
The cat catch the mouse yesterday.,The cat caught the mouse yesterday.
The airplane fly over the city.,The airplane flies over the city.
He do his homework every evening.,He does his homework every evening.
They was at the concert last night.,They were at the concert last night.
The computer running slow today.,The computer is running slow today.
She buy a new dress for the party.,She buys a new dress for the party.
The birds sings in the morning.,The birds sing in the morning.
He will finish the race in an hour.,He will finish the race in an hour.
She make a cake for her friend's birthday.,She makes a cake for her friend's birthday.
The train leave at 6 PM.,The train leaves at 6 PM.
They was listening to music.,They were listening to music.
The scientist perform experiments in the lab.,The scientist performs experiments in the lab.
The baby cry when it's hungry.,The baby cries when it's hungry.
The teacher teach the students in the classroom.,The teacher teaches the students in the classroom.
I was work on the project all day.,I was working on the project all day.
She has paint her room last week.,She painted her room last week.
The dog was chase the squirrel.,The dog was chasing the squirrel.
The flowers was watered by the gardener.,The flowers were watered by the gardener.
The car has been wash this morning.,The car has been washed this morning.
The manager gives a speech at the meeting.,The manager gave a speech at the meeting.
They takes a vacation every summer.,They take a vacation every summer.
He swims in the pool every day last summer.,He swam in the pool every day last summer.
The athlete wins the gold medal in the race.,The athlete won the gold medal in the race.
She is dance at the party last night.,She was dancing at the party last night.
The teacher was grading the papers all night.,The teacher graded the papers all night.
The children build a sandcastle on the beach.,The children built a sandcastle on the beach.
The company launch a new product next month.,The company will launch a new product next month.
I have been study for the test for two weeks.,I have been studying for the test for two weeks.
The photographer take a picture of the sunset.,The photographer took a picture of the sunset.
The artist was draw a portrait of the model.,The artist was drawing a portrait of the model.
He is read a book before going to bed.,He reads a book before going to bed.
The player scores a goal during the match.,The player scored a goal during the match.
The tourists visit the museum yesterday.,The tourists visited the museum yesterday.
The weather forecast say it will rain tomorrow.,The weather forecast says it will rain tomorrow.
The farmer has plant the seeds in the field.,The farmer has planted the seeds in the field.
She has been make dinner for the family.,She has been making dinner for the family.
The students were study for their exams.,The students were studying for their exams.
The concert begins in an hour.,The concert will begin in an hour.
The neighbors was moving out yesterday.,The neighbors were moving out yesterday.
The children has fun at the amusement park.,The children had fun at the amusement park.
The pilot was fly the plane during the storm.,The pilot was flying the plane during the storm.
She has bake cookies for the bake sale.,She has baked cookies for the bake sale.
The waiter serve the food to the customers.,The waiter served the food to the customers.
The author has been write a new book.,The author has been writing a new book.
The delivery driver brings the package yesterday.,The delivery driver brought the package yesterday.
The students was taking a test in the classroom.,The students were taking a test in the classroom.
He is take a break from work.,He is taking a break from work.
The party was organize by the event planner.,The party was organized by the event planner.
The mechanic was fixing the car.,The mechanic fixed the car.
The movie start at 8 PM.,The movie starts at 8 PM.
The gardener is plant flowers in the garden.,The gardener is planting flowers in the garden.
The team were working on the project.,The team was working on the project.
The musician perform at the concert.,The musician performed at the concert.
She is going to shopping after work.,She is going shopping after work.
The store close at 9 PM tonight.,The store closes at 9 PM tonight.
The cat was lay on the sofa.,The cat was lying on the sofa.
The engine is make a strange noise.,The engine is making a strange noise.
The students are prepare for their presentations.,The students are preparing for their presentations.
The volunteers was helping at the event.,The volunteers were helping at the event.
The birds was flying south for the winter.,The birds were flying south for the winter.
The cake was bake in the oven.,The cake was baked in the oven.
The package is deliver yesterday.,The package was delivered yesterday.
The athlete is train for the competition.,The athlete is training for the competition.
The car was wash by the teenager.,The car was washed by the teenager.
She is speak at the conference tomorrow.,She is speaking at the conference tomorrow.
The doctor was examine the patient.,The doctor examined the patient.
The store is open late on Fridays.,The store opens late on Fridays.
The tree was falling during the storm.,The tree fell during the storm.
The children was playing in the park.,The children were playing in the park.
The cake is frost with chocolate icing.,The cake is frosted with chocolate icing.
The employee is work late tonight.,The employee is working late tonight.
The train was delay due to bad weather.,The train was delayed due to bad weather.
The phone is charge on the table.,The phone is charging on the table.
The dog was dig a hole in the yard.,The dog was digging a hole in the yard.
The students is studying in the library.,The students are studying in the library.
The pizza is deliver to the wrong address.,The pizza was delivered to the wrong address.
The project is complete by the deadline.,The project was completed by the deadline.
The concert was cancel due to rain.,The concert was canceled due to rain.
The waitress is take our order.,The waitress is taking our order.
The dogs runs quickly to the park.,The dogs run quickly to the park.
She go to the library every Tuesday.,She goes to the library every Tuesday.
The results of the experiments was inconclusive.,The results of the experiments were inconclusive.
The team of researchers are committed to finding a solution.,The team of researchers is committed to finding a solution.
The pile of clothes need to be washed.,The pile of clothes needs to be washed.
The collection of stamps have been growing steadily.,The collection of stamps has been growing steadily.
The group of students works on the project together.,The group of students work on the project together.
The computers in the lab was updated last week.,The computers in the lab were updated last week.
The list of ingredients in the recipe need revision.,The list of ingredients in the recipe needs revision.
My family enjoys going on vacation together.,My family enjoy going on vacation together.
The audience was clapping their hands enthusiastically.,The audience were clapping their hands enthusiastically.
The company's policies is constantly evolving.,The company's policies are constantly evolving.
The employees at the store works diligently.,The employees at the store work diligently.
The children plays in the park every afternoon.,The children play in the park every afternoon.
The bakeries in this area makes delicious pastries.,The bakeries in this area make delicious pastries.
The book that I borrowed from the library were very interesting.,The book that I borrowed from the library was very interesting.
The collection of coins are displayed in the museum.,The collection of coins is displayed in the museum.
The committee have decided on a course of action.,The committee has decided on a course of action.
The musicians practices together every Saturday.,The musicians practice together every Saturday.
The dishes in the sink needs to be cleaned.,The dishes in the sink need to be cleaned.
The flights to New York was cancelled due to bad weather.,The flights to New York were cancelled due to bad weather.
The film festival have a great lineup this year.,The film festival has a great lineup this year.
The students in the class was excited about the field trip.,The students in the class were excited about the field trip.
The package of documents need to be delivered by tomorrow.,The package of documents needs to be delivered by tomorrow.
The plants in the garden has grown significantly.,The plants in the garden have grown significantly.
The shelves was filled with books.,The shelves were filled with books.
The faculty in the department is diverse and experienced.,The faculty in the department are diverse and experienced.
The orchestra perform at the concert hall every month.,The orchestra performs at the concert hall every month.
The series of events leading up to the incident was complicated.,The series of events leading up to the incident were complicated.
The couple takes a walk in the park every evening.,The couple take a walk in the park every evening.
The laws of physics governs the universe.,The laws of physics govern the universe.
The group of protestors was chanting loudly.,The group of protestors were chanting loudly.
The pair of shoes I bought yesterday was too tight.,The pair of shoes I bought yesterday were too tight.
The flock of birds fly south for the winter.,The flock of birds flies south for the winter.
The set of keys are on the kitchen counter.,The set of keys is on the kitchen counter.
The team of engineers designs the new product.,The team of engineers design the new product.
The list of tasks to complete was overwhelming.,The list of tasks to complete were overwhelming.
The group of tourists takes pictures of the monument.,The group of tourists take pictures of the monument.
The stack of papers on the desk need to be sorted.,The stack of papers on the desk needs to be sorted.
The number of people in the room was growing.,The number of people in the room were growing.
The families in the neighborhood brings food to the potluck.,The families in the neighborhood bring food to the potluck.
The collection of short stories have a common theme.,The collection of short stories has a common theme.
The staff at the hotel makes sure the guests are comfortable.,The staff at the hotel make sure the guests are comfortable.
The bundle of letters was tied with a ribbon.,The bundle of letters were tied with a ribbon.
The pair of jeans fit me perfectly.,The pair of jeans fits me perfectly.
The variety of plants in the greenhouse needs special care.,The variety of plants in the greenhouse need special care.
The audience enjoys the show immensely.,The audience enjoy the show immensely.
The group of instruments in the orchestra creates a unique sound.,The group of instruments in the orchestra create a unique sound.
The herd of cows graze in the field.,The herd of cows grazes in the field.
The set of tools are in the garage.,The set of tools is in the garage.
The series of lectures on history was very informative.,The series of lectures on history were very informative.
The team of doctors have developed a new treatment.,The team of doctors has developed a new treatment.
The crowd of people was waiting for the parade to start.,The crowd of people were waiting for the parade to start.
The group of volunteers work tirelessly to help the community.,The group of volunteers works tirelessly to help the community.
The couple plans their wedding together.,The couple plan their wedding together.
The assortment of candies in the store looks delicious.,The assortment of candies in the store look delicious.
The range of mountains stretches across the horizon.,The range of mountains stretch across the horizon.
The series of tests was challenging for the students.,The series of tests were challenging for the students.
The set of rules governs how the game is played.,The set of rules govern how the game is played.
The number of tasks to complete have increased.,The number of tasks to complete has increased.
The group of fish swim together in the tank.,The group of fish swims together in the tank.
The variety of birds in the aviary is amazing.,The variety of birds in the aviary are amazing.
The class of students have different learning styles.,The class of students has different learning styles.
The group of friends meets every week for dinner.,The group of friends meet every week for dinner.
The bunch of grapes has started to rot.,The bunch of grapes have started to rot.
The pair of socks has holes in them.,The pair of socks have holes in them.
The range of products offered by the company are vast.,The range of products offered by the company is vast.
The cluster of stars form a constellation.,The cluster of stars forms a constellation.
The group of hikers takes a break by the waterfall.,The group of hikers take a break by the waterfall.
The class of students was eager to learn.,The class of students were eager to learn.
The selection of movies at the theater is impressive.,The selection of movies at the theater are impressive.
The government's policies has a significant impact on the economy.,The government's policies have a significant impact on the economy.
The series of paintings in the gallery tell a story.,The series of paintings in the gallery tells a story.
The cast of the play have been rehearsing for months.,The cast of the play has been rehearsing for months.
The group of scientists study the effects of climate change.,The group of scientists studies the effects of climate change.
The family of deer grazes in the meadow.,The family of deer graze in the meadow.
The pair of earrings has been misplaced.,The pair of earrings have been misplaced.
The group of musicians have a unique sound.,The group of musicians has a unique sound.
The set of dishes in the cupboard is antique.,The set of dishes in the cupboard are antique.
The number of books in the library continues to grow.,The number of books in the library continue to grow.
The group of dancers perform in perfect unison.,The group of dancers performs in perfect unison.
The variety of food at the buffet has something for everyone.,The variety of food at the buffet have something for everyone.
The crowd of spectators cheers for their favorite team.,The crowd of spectators cheer for their favorite team.
The team of writers collaborate on the script.,The team of writers collaborates on the script.
The set of instructions was difficult to follow.,The set of instructions were difficult to follow.
The group of birds nests in the trees.,The group of birds nest in the trees.
The assortment of toys in the store is impressive.,The assortment of toys in the store are impressive.
The choir of singers sings beautifully.,The choir of singers sing beautifully.
The series of articles on the topic was enlightening.,The series of articles on the topic were enlightening.
The pair of gloves keeps my hands warm.,The pair of gloves keep my hands warm.
The group of flowers in the vase is wilting.,The group of flowers in the vase are wilting.
The set of questions in the exam was challenging.,The set of questions in the exam were challenging.
The number of people attending the event has increased.,The number of people attending the event have increased.
The group of animals in the zoo attracts a lot of visitors.,The group of animals in the zoo attract a lot of visitors.
The variety of courses offered by the university is diverse.,The variety of courses offered by the university are diverse.
The cast of characters in the novel was memorable.,The cast of characters in the novel were memorable.
The team of athletes train together every day.,The team of athletes trains together every day.
The group of students in the club organizes events.,The group of students in the club organize events.
The family of languages share common features.,The family of languages shares common features.
The collection of essays was edited by the professor.,The collection of essays were edited by the professor.
I went to a school yesterday.,I went to school yesterday.
She bought the ice cream for her daughter.,She bought ice cream for her daughter.
He has a unique collection of a coins.,He has a unique collection of coins.
An apple a day keeps doctor away.,An apple a day keeps the doctor away.
Please pass me an salt shaker.,Please pass me the salt shaker.
I am looking forward to an vacation.,I am looking forward to a vacation.
They are attending a wedding of an friend.,They are attending a wedding of a friend.
The Earth revolves around a Sun.,The Earth revolves around the Sun.
She works in a finance industry.,She works in the finance industry.
Did you finish an work you had to do?,Did you finish the work you had to do?
He was late because of an heavy traffic.,He was late because of heavy traffic.
She is an expert on a human behavior.,She is an expert on human behavior.
We went to a beach to enjoy a sunshine.,We went to the beach to enjoy the sunshine.
"Can you turn off a television, please?","Can you turn off the television, please?"
The artist used a watercolor to paint a picture.,The artist used watercolor to paint the picture.
I need to buy a new pair of a shoes.,I need to buy a new pair of shoes.
She is studying a history of art.,She is studying the history of art.
They are going to a museum of modern art.,They are going to the museum of modern art.
He is a fan of a basketball.,He is a fan of basketball.
The cat is hiding under a table.,The cat is hiding under the table.
She is waiting for a bus at a bus stop.,She is waiting for the bus at the bus stop.
He is a member of a chess club.,He is a member of the chess club.
The students are learning a chemistry in class.,The students are learning chemistry in class.
Can you hand me a book about a science fiction?,Can you hand me a book about science fiction?
She is reading a newspaper while drinking a tea.,She is reading the newspaper while drinking tea.
The movie is based on a true story.,The movie is based on a true story.
He is attending a conference on a technology.,He is attending a conference on technology.
She is an expert in a field of psychology.,She is an expert in the field of psychology.
The dog is chasing a ball in a park.,The dog is chasing a ball in the park.
The flowers are blooming in a springtime.,The flowers are blooming in the springtime.
The waiter brought a menu to a table.,The waiter brought the menu to the table.
They are planning a trip to a Europe.,They are planning a trip to Europe.
The car is parked in a garage.,The car is parked in the garage.
The boy is playing with a toy car.,The boy is playing with a toy car.
She is learning a new language at a school.,She is learning a new language at the school.
The cake is decorated with a flowers.,The cake is decorated with flowers.
He is listening to a music on a radio.,He is listening to music on the radio.
She went to a store to buy a groceries.,She went to the store to buy groceries.
The package was delivered by a mail carrier.,The package was delivered by the mail carrier.
The bird is sitting on a branch of a tree.,The bird is sitting on a branch of the tree.
I have a meeting with a principal of a school.,I have a meeting with the principal of the school.
The athlete is training for a marathon race.,The athlete is training for a marathon race.
He bought a ticket for a concert of his favorite band.,He bought a ticket for the concert of his favorite band.
The doctor is giving advice on a healthy lifestyle.,The doctor is giving advice on healthy lifestyle.
The chef is preparing a delicious meal in a kitchen.,The chef is preparing a delicious meal in the kitchen.
The students are working on a project in a library.,The students are working on a project in the library.
She is reading a book about a personal development.,She is reading a book about personal development.
The company is investing in a renewable energy.,The company is investing in renewable energy.
The scientist discovered a new species of a plant.,The scientist discovered a new species of plant.
The tourists are visiting a famous monument.,The tourists are visiting the famous monument.
The children are playing a soccer in a park.,The children are playing soccer in the park.
He is a fan of a classical music.,He is a fan of classical music.
The couple is taking a walk in a park.,The couple is taking a walk in the park.
The audience enjoyed a performance of a play.,The audience enjoyed the performance of the play.
The teacher is explaining a new concept to a students.,The teacher is explaining a new concept to the students.
The family is having a dinner at a restaurant.,The family is having dinner at the restaurant.
The airplane is flying above a clouds.,The airplane is flying above the clouds.
She is wearing a beautiful dress to a party.,She is wearing a beautiful dress to the party.
The artist is painting a landscape with a oil paint.,The artist is painting a landscape with oil paint.
The child is playing with a sand at a beach.,The child is playing with sand at the beach.
The workers are constructing a new building.,The workers are constructing the new building.
The team is celebrating their victory in a competition.,The team is celebrating their victory in the competition.
The author is signing a copies of her new book.,The author is signing copies of her new book.
He is looking at a stars through a telescope.,He is looking at the stars through a telescope.
The farmer is harvesting a crops in a field.,The farmer is harvesting crops in the field.
The family is watching a movie together at a home.,The family is watching a movie together at home.
The students are practicing a yoga in a gym.,The students are practicing yoga in the gym.
The musician is playing a piano in a concert hall.,The musician is playing the piano in a concert hall.
The volunteers are cleaning a beach on a weekend.,The volunteers are cleaning the beach on the weekend.
The car is making a strange noise when a engine is running.,The car is making a strange noise when the engine is running.
The city is famous for a unique architecture.,The city is famous for its unique architecture.
The couple is taking a vacation in a tropical island.,The couple is taking a vacation on a tropical island.
The museum is featuring a new exhibit about a ancient civilizations.,The museum is featuring a new exhibit about ancient civilizations.
The photographer is taking pictures of a wildlife.,The photographer is taking pictures of wildlife.
The passengers are waiting for a train at a train station.,The passengers are waiting for the train at the train station.
The computer is displaying an error message on a screen.,The computer is displaying an error message on the screen.
The weather forecast predicts a rain for a tomorrow.,The weather forecast predicts rain for tomorrow.
The plants need a water and a sunlight to grow.,The plants need water and sunlight to grow.
The patient is recovering from a surgery at a hospital.,The patient is recovering from surgery at the hospital.
The government is implementing a new policies to improve a economy.,The government is implementing new policies to improve the economy.
The audience is waiting for a show to start.,The audience is waiting for the show to start.
The squirrel is collecting a nuts for a winter.,The squirrel is collecting nuts for the winter.
The player scored a goal during a soccer match.,The player scored a goal during the soccer match.
The speaker is giving a presentation on a social issues.,The speaker is giving a presentation on social issues.
The tourists are exploring a city on a guided tour.,The tourists are exploring the city on a guided tour.
The employees are attending a training session at a company.,The employees are attending a training session at the company.
The crowd is cheering for a home team at a sports event.,The crowd is cheering for the home team at the sports event.
The scientist is conducting a research on a climate change.,The scientist is conducting research on climate change.
The chef is cooking a meal using a fresh ingredients.,The chef is cooking a meal using fresh ingredients.
The hikers are enjoying a view from a top of a mountain.,The hikers are enjoying the view from the top of the mountain.
